
*** Running vivado
    with args -log cache_controller.vdi -applog -m64 -product Vivado -messageDb vivado.pb -mode batch -source cache_controller.tcl -notrace


****** Vivado v2017.1 (64-bit)
  **** SW Build 1846317 on Fri Apr 14 18:55:03 MDT 2017
  **** IP Build 1846188 on Fri Apr 14 20:52:08 MDT 2017
    ** Copyright 1986-2017 Xilinx, Inc. All Rights Reserved.

source cache_controller.tcl -notrace
Design is defaulting to srcset: sources_1
Design is defaulting to constrset: constrs_1
INFO: [Netlist 29-17] Analyzing 80 Unisim elements for replacement
INFO: [Netlist 29-28] Unisim Transformation completed in 0 CPU seconds
INFO: [Project 1-479] Netlist was created with Vivado 2017.1
INFO: [Device 21-403] Loading part xc7k70tfbv676-1
INFO: [Project 1-570] Preparing netlist for logic optimization
INFO: [Opt 31-138] Pushed 0 inverter(s) to 0 load pin(s).
INFO: [Project 1-111] Unisim Transformation Summary:
No Unisim elements were transformed.

link_design: Time (s): cpu = 00:00:06 ; elapsed = 00:00:06 . Memory (MB): peak = 478.816 ; gain = 248.352
Command: opt_design
Attempting to get a license for feature 'Implementation' and/or device 'xc7k70t-fbv676'
INFO: [Common 17-349] Got license for feature 'Implementation' and/or device 'xc7k70t-fbv676'
Running DRC as a precondition to command opt_design

Starting DRC Task
Command: report_drc (run_mandatory_drcs) for: opt_checks
INFO: [DRC 23-27] Running DRC with 2 threads
report_drc (run_mandatory_drcs) completed successfully
INFO: [Project 1-461] DRC finished with 0 Errors
INFO: [Project 1-462] Please refer to the DRC report (report_drc) for more information.

Time (s): cpu = 00:00:00 ; elapsed = 00:00:00.462 . Memory (MB): peak = 489.395 ; gain = 10.578
INFO: [Timing 38-35] Done setting XDC timing constraints.

Starting Logic Optimization Task

Phase 1 Retarget
INFO: [Opt 31-138] Pushed 0 inverter(s) to 0 load pin(s).
INFO: [Opt 31-49] Retargeted 0 cell(s).
Phase 1 Retarget | Checksum: faf72314

Time (s): cpu = 00:00:00 ; elapsed = 00:00:00.016 . Memory (MB): peak = 995.320 ; gain = 0.000
INFO: [Opt 31-389] Phase Retarget created 0 cells and removed 0 cells

Phase 2 Constant propagation
INFO: [Opt 31-138] Pushed 0 inverter(s) to 0 load pin(s).
Phase 2 Constant propagation | Checksum: faf72314

Time (s): cpu = 00:00:00 ; elapsed = 00:00:00.035 . Memory (MB): peak = 995.320 ; gain = 0.000
INFO: [Opt 31-389] Phase Constant propagation created 0 cells and removed 0 cells

Phase 3 Sweep
Phase 3 Sweep | Checksum: 29d69f35

Time (s): cpu = 00:00:00 ; elapsed = 00:00:00.054 . Memory (MB): peak = 995.320 ; gain = 0.000
INFO: [Opt 31-389] Phase Sweep created 0 cells and removed 0 cells

Phase 4 BUFG optimization
Phase 4 BUFG optimization | Checksum: 29d69f35

Time (s): cpu = 00:00:00 ; elapsed = 00:00:00.063 . Memory (MB): peak = 995.320 ; gain = 0.000
INFO: [Opt 31-389] Phase BUFG optimization created 0 cells and removed 0 cells

Phase 5 Shift Register Optimization
Phase 5 Shift Register Optimization | Checksum: 29d69f35

Time (s): cpu = 00:00:00 ; elapsed = 00:00:00.064 . Memory (MB): peak = 995.320 ; gain = 0.000
INFO: [Opt 31-389] Phase Shift Register Optimization created 0 cells and removed 0 cells

Starting Connectivity Check Task

Time (s): cpu = 00:00:00 ; elapsed = 00:00:00.002 . Memory (MB): peak = 995.320 ; gain = 0.000
Ending Logic Optimization Task | Checksum: 29d69f35

Time (s): cpu = 00:00:00 ; elapsed = 00:00:00.067 . Memory (MB): peak = 995.320 ; gain = 0.000

Starting Power Optimization Task
INFO: [Pwropt 34-132] Skipping clock gating for clocks with a period < 2.00 ns.
Ending Power Optimization Task | Checksum: fc888e9a

Time (s): cpu = 00:00:00 ; elapsed = 00:00:00.014 . Memory (MB): peak = 995.320 ; gain = 0.000
21 Infos, 0 Warnings, 0 Critical Warnings and 0 Errors encountered.
opt_design completed successfully
opt_design: Time (s): cpu = 00:00:10 ; elapsed = 00:00:10 . Memory (MB): peak = 995.320 ; gain = 516.504
INFO: [Common 17-1381] The checkpoint 'E:/CODlab/cache/vivado/cache_controller.runs/impl_1/cache_controller_opt.dcp' has been generated.
Command: report_drc -file cache_controller_drc_opted.rpt
INFO: [DRC 23-27] Running DRC with 2 threads
INFO: [Coretcl 2-168] The results of DRC are in file E:/CODlab/cache/vivado/cache_controller.runs/impl_1/cache_controller_drc_opted.rpt.
report_drc completed successfully
INFO: [Chipscope 16-241] No debug cores found in the current design.
Before running the implement_debug_core command, either use the Set Up Debug wizard (GUI mode)
or use the create_debug_core and connect_debug_core Tcl commands to insert debug cores into the design.
Command: place_design
Attempting to get a license for feature 'Implementation' and/or device 'xc7k70t-fbv676'
INFO: [Common 17-349] Got license for feature 'Implementation' and/or device 'xc7k70t-fbv676'
Command: report_drc (run_mandatory_drcs) for: incr_eco_checks
INFO: [DRC 23-27] Running DRC with 2 threads
report_drc (run_mandatory_drcs) completed successfully
INFO: [Vivado_Tcl 4-198] DRC finished with 0 Errors
INFO: [Vivado_Tcl 4-199] Please refer to the DRC report (report_drc) for more information.
Running DRC as a precondition to command place_design
Command: report_drc (run_mandatory_drcs) for: placer_checks
INFO: [DRC 23-27] Running DRC with 2 threads
report_drc (run_mandatory_drcs) completed successfully
INFO: [Vivado_Tcl 4-198] DRC finished with 0 Errors
INFO: [Vivado_Tcl 4-199] Please refer to the DRC report (report_drc) for more information.

Starting Placer Task
INFO: [Place 30-611] Multithreading enabled for place_design using a maximum of 2 CPUs

Phase 1 Placer Initialization

Phase 1.1 Placer Initialization Netlist Sorting
Netlist sorting complete. Time (s): cpu = 00:00:00 ; elapsed = 00:00:00 . Memory (MB): peak = 995.320 ; gain = 0.000
Phase 1.1 Placer Initialization Netlist Sorting | Checksum: 370310a7

Time (s): cpu = 00:00:00 ; elapsed = 00:00:00.009 . Memory (MB): peak = 995.320 ; gain = 0.000
INFO: [Timing 38-35] Done setting XDC timing constraints.
INFO: [Opt 31-138] Pushed 0 inverter(s) to 0 load pin(s).
Netlist sorting complete. Time (s): cpu = 00:00:00 ; elapsed = 00:00:00 . Memory (MB): peak = 995.320 ; gain = 0.000

Phase 1.2 IO Placement/ Clock Placement/ Build Placer Device
INFO: [Timing 38-35] Done setting XDC timing constraints.
Phase 1.2 IO Placement/ Clock Placement/ Build Placer Device | Checksum: fb98db6d

Time (s): cpu = 00:00:02 ; elapsed = 00:00:00.950 . Memory (MB): peak = 995.320 ; gain = 0.000

Phase 1.3 Build Placer Netlist Model
Phase 1.3 Build Placer Netlist Model | Checksum: 1cc817238

Time (s): cpu = 00:00:02 ; elapsed = 00:00:00.975 . Memory (MB): peak = 995.320 ; gain = 0.000

Phase 1.4 Constrain Clocks/Macros
Phase 1.4 Constrain Clocks/Macros | Checksum: 1cc817238

Time (s): cpu = 00:00:02 ; elapsed = 00:00:00.978 . Memory (MB): peak = 995.320 ; gain = 0.000
Phase 1 Placer Initialization | Checksum: 1cc817238

Time (s): cpu = 00:00:02 ; elapsed = 00:00:00.981 . Memory (MB): peak = 995.320 ; gain = 0.000

Phase 2 Global Placement
WARNING: [Place 46-30] place_design is not in timing mode. Skip physical synthesis in placer
Phase 2 Global Placement | Checksum: 14a09ca64

Time (s): cpu = 00:00:02 ; elapsed = 00:00:01 . Memory (MB): peak = 995.320 ; gain = 0.000

Phase 3 Detail Placement

Phase 3.1 Commit Multi Column Macros
Phase 3.1 Commit Multi Column Macros | Checksum: 14a09ca64

Time (s): cpu = 00:00:02 ; elapsed = 00:00:01 . Memory (MB): peak = 995.320 ; gain = 0.000

Phase 3.2 Commit Most Macros & LUTRAMs
Phase 3.2 Commit Most Macros & LUTRAMs | Checksum: 112b42fb2

Time (s): cpu = 00:00:02 ; elapsed = 00:00:01 . Memory (MB): peak = 995.320 ; gain = 0.000

Phase 3.3 Area Swap Optimization
Phase 3.3 Area Swap Optimization | Checksum: 17be47829

Time (s): cpu = 00:00:02 ; elapsed = 00:00:01 . Memory (MB): peak = 995.320 ; gain = 0.000

Phase 3.4 Pipeline Register Optimization
Phase 3.4 Pipeline Register Optimization | Checksum: 17be47829

Time (s): cpu = 00:00:02 ; elapsed = 00:00:01 . Memory (MB): peak = 995.320 ; gain = 0.000

Phase 3.5 Small Shape Detail Placement
Phase 3.5 Small Shape Detail Placement | Checksum: 1f3bbac3f

Time (s): cpu = 00:00:02 ; elapsed = 00:00:01 . Memory (MB): peak = 995.320 ; gain = 0.000

Phase 3.6 Re-assign LUT pins
Phase 3.6 Re-assign LUT pins | Checksum: 1f3bbac3f

Time (s): cpu = 00:00:02 ; elapsed = 00:00:01 . Memory (MB): peak = 995.320 ; gain = 0.000

Phase 3.7 Pipeline Register Optimization
Phase 3.7 Pipeline Register Optimization | Checksum: 1f3bbac3f

Time (s): cpu = 00:00:02 ; elapsed = 00:00:01 . Memory (MB): peak = 995.320 ; gain = 0.000
Phase 3 Detail Placement | Checksum: 1f3bbac3f

Time (s): cpu = 00:00:02 ; elapsed = 00:00:01 . Memory (MB): peak = 995.320 ; gain = 0.000

Phase 4 Post Placement Optimization and Clean-Up

Phase 4.1 Post Commit Optimization
Phase 4.1 Post Commit Optimization | Checksum: 1f3bbac3f

Time (s): cpu = 00:00:02 ; elapsed = 00:00:01 . Memory (MB): peak = 995.320 ; gain = 0.000

Phase 4.2 Post Placement Cleanup
Phase 4.2 Post Placement Cleanup | Checksum: 1f3bbac3f

Time (s): cpu = 00:00:02 ; elapsed = 00:00:01 . Memory (MB): peak = 995.320 ; gain = 0.000

Phase 4.3 Placer Reporting
Phase 4.3 Placer Reporting | Checksum: 1f3bbac3f

Time (s): cpu = 00:00:02 ; elapsed = 00:00:01 . Memory (MB): peak = 995.320 ; gain = 0.000

Phase 4.4 Final Placement Cleanup
Phase 4.4 Final Placement Cleanup | Checksum: 2569dd47a

Time (s): cpu = 00:00:02 ; elapsed = 00:00:01 . Memory (MB): peak = 995.320 ; gain = 0.000
Phase 4 Post Placement Optimization and Clean-Up | Checksum: 2569dd47a

Time (s): cpu = 00:00:02 ; elapsed = 00:00:01 . Memory (MB): peak = 995.320 ; gain = 0.000
Ending Placer Task | Checksum: 165a9cad9

Time (s): cpu = 00:00:02 ; elapsed = 00:00:01 . Memory (MB): peak = 995.320 ; gain = 0.000
36 Infos, 1 Warnings, 0 Critical Warnings and 0 Errors encountered.
place_design completed successfully
Writing placer database...
Writing XDEF routing.
Writing XDEF routing logical nets.
Writing XDEF routing special nets.
Write XDEF Complete: Time (s): cpu = 00:00:00 ; elapsed = 00:00:00.078 . Memory (MB): peak = 995.320 ; gain = 0.000
INFO: [Common 17-1381] The checkpoint 'E:/CODlab/cache/vivado/cache_controller.runs/impl_1/cache_controller_placed.dcp' has been generated.
report_io: Time (s): cpu = 00:00:01 ; elapsed = 00:00:00.083 . Memory (MB): peak = 995.320 ; gain = 0.000
report_utilization: Time (s): cpu = 00:00:00 ; elapsed = 00:00:00.020 . Memory (MB): peak = 995.320 ; gain = 0.000
report_control_sets: Time (s): cpu = 00:00:00 ; elapsed = 00:00:00.001 . Memory (MB): peak = 995.320 ; gain = 0.000
Command: route_design
Attempting to get a license for feature 'Implementation' and/or device 'xc7k70t-fbv676'
INFO: [Common 17-349] Got license for feature 'Implementation' and/or device 'xc7k70t-fbv676'
Running DRC as a precondition to command route_design
Command: report_drc (run_mandatory_drcs) for: router_checks
INFO: [DRC 23-27] Running DRC with 2 threads
report_drc (run_mandatory_drcs) completed successfully
INFO: [Vivado_Tcl 4-198] DRC finished with 0 Errors
INFO: [Vivado_Tcl 4-199] Please refer to the DRC report (report_drc) for more information.


Starting Routing Task
INFO: [Route 35-254] Multithreading enabled for route_design using a maximum of 2 CPUs
Checksum: PlaceDB: 77d99d3e ConstDB: 0 ShapeSum: edd02d9b RouteDB: 0

Phase 1 Build RT Design
Phase 1 Build RT Design | Checksum: 10930c6be

Time (s): cpu = 00:00:11 ; elapsed = 00:00:08 . Memory (MB): peak = 1127.406 ; gain = 132.086

Phase 2 Router Initialization
INFO: [Route 35-64] No timing constraints were detected. The router will operate in resource-optimization mode.

Phase 2.1 Fix Topology Constraints
Phase 2.1 Fix Topology Constraints | Checksum: 10930c6be

Time (s): cpu = 00:00:11 ; elapsed = 00:00:08 . Memory (MB): peak = 1129.500 ; gain = 134.180

Phase 2.2 Pre Route Cleanup
Phase 2.2 Pre Route Cleanup | Checksum: 10930c6be

Time (s): cpu = 00:00:11 ; elapsed = 00:00:08 . Memory (MB): peak = 1129.500 ; gain = 134.180
 Number of Nodes with overlaps = 0
Phase 2 Router Initialization | Checksum: d58379da

Time (s): cpu = 00:00:11 ; elapsed = 00:00:08 . Memory (MB): peak = 1141.762 ; gain = 146.441

Phase 3 Initial Routing
Phase 3 Initial Routing | Checksum: 152223e5b

Time (s): cpu = 00:00:11 ; elapsed = 00:00:08 . Memory (MB): peak = 1141.762 ; gain = 146.441

Phase 4 Rip-up And Reroute

Phase 4.1 Global Iteration 0
 Number of Nodes with overlaps = 12
 Number of Nodes with overlaps = 0
Phase 4.1 Global Iteration 0 | Checksum: 89df168e

Time (s): cpu = 00:00:11 ; elapsed = 00:00:08 . Memory (MB): peak = 1141.762 ; gain = 146.441
Phase 4 Rip-up And Reroute | Checksum: 89df168e

Time (s): cpu = 00:00:11 ; elapsed = 00:00:08 . Memory (MB): peak = 1141.762 ; gain = 146.441

Phase 5 Delay and Skew Optimization
Phase 5 Delay and Skew Optimization | Checksum: 89df168e

Time (s): cpu = 00:00:11 ; elapsed = 00:00:08 . Memory (MB): peak = 1141.762 ; gain = 146.441

Phase 6 Post Hold Fix

Phase 6.1 Hold Fix Iter
Phase 6.1 Hold Fix Iter | Checksum: 89df168e

Time (s): cpu = 00:00:11 ; elapsed = 00:00:08 . Memory (MB): peak = 1141.762 ; gain = 146.441
Phase 6 Post Hold Fix | Checksum: 89df168e

Time (s): cpu = 00:00:11 ; elapsed = 00:00:08 . Memory (MB): peak = 1141.762 ; gain = 146.441

Phase 7 Route finalize

Router Utilization Summary
  Global Vertical Routing Utilization    = 0.114552 %
  Global Horizontal Routing Utilization  = 0.0300935 %
  Routable Net Status*
  *Does not include unroutable nets such as driverless and loadless.
  Run report_route_status for detailed report.
  Number of Failed Nets               = 0
  Number of Unrouted Nets             = 0
  Number of Partially Routed Nets     = 0
  Number of Node Overlaps             = 0

Congestion Report
North Dir 1x1 Area, Max Cong = 34.2342%, No Congested Regions.
South Dir 1x1 Area, Max Cong = 22.5225%, No Congested Regions.
East Dir 1x1 Area, Max Cong = 8.82353%, No Congested Regions.
West Dir 1x1 Area, Max Cong = 10.2941%, No Congested Regions.
Phase 7 Route finalize | Checksum: 89df168e

Time (s): cpu = 00:00:11 ; elapsed = 00:00:08 . Memory (MB): peak = 1141.762 ; gain = 146.441

Phase 8 Verifying routed nets

 Verification completed successfully
Phase 8 Verifying routed nets | Checksum: 89df168e

Time (s): cpu = 00:00:11 ; elapsed = 00:00:08 . Memory (MB): peak = 1141.762 ; gain = 146.441

Phase 9 Depositing Routes
Phase 9 Depositing Routes | Checksum: 11bffc716

Time (s): cpu = 00:00:11 ; elapsed = 00:00:08 . Memory (MB): peak = 1141.762 ; gain = 146.441
INFO: [Route 35-16] Router Completed Successfully

Time (s): cpu = 00:00:11 ; elapsed = 00:00:08 . Memory (MB): peak = 1141.762 ; gain = 146.441

Routing Is Done.
44 Infos, 1 Warnings, 0 Critical Warnings and 0 Errors encountered.
route_design completed successfully
route_design: Time (s): cpu = 00:00:12 ; elapsed = 00:00:09 . Memory (MB): peak = 1141.762 ; gain = 146.441
Writing placer database...
Writing XDEF routing.
Writing XDEF routing logical nets.
Writing XDEF routing special nets.
Write XDEF Complete: Time (s): cpu = 00:00:00 ; elapsed = 00:00:00.041 . Memory (MB): peak = 1141.762 ; gain = 0.000
INFO: [Common 17-1381] The checkpoint 'E:/CODlab/cache/vivado/cache_controller.runs/impl_1/cache_controller_routed.dcp' has been generated.
Command: report_drc -file cache_controller_drc_routed.rpt -pb cache_controller_drc_routed.pb -rpx cache_controller_drc_routed.rpx
INFO: [DRC 23-27] Running DRC with 2 threads
INFO: [Coretcl 2-168] The results of DRC are in file E:/CODlab/cache/vivado/cache_controller.runs/impl_1/cache_controller_drc_routed.rpt.
report_drc completed successfully
Command: report_methodology -file cache_controller_methodology_drc_routed.rpt -rpx cache_controller_methodology_drc_routed.rpx
INFO: [Timing 38-35] Done setting XDC timing constraints.
INFO: [DRC 23-133] Running Methodology with 2 threads
INFO: [Coretcl 2-1520] The results of Report Methodology are in file E:/CODlab/cache/vivado/cache_controller.runs/impl_1/cache_controller_methodology_drc_routed.rpt.
report_methodology completed successfully
Command: report_power -file cache_controller_power_routed.rpt -pb cache_controller_power_summary_routed.pb -rpx cache_controller_power_routed.rpx
WARNING: [Power 33-232] No user defined clocks were found in the design!
Resolution: Please specify clocks using create_clock/create_generated_clock for sequential elements. For pure combinatorial circuits, please specify a virtual clock, otherwise the vectorless estimation might be inaccurate
INFO: [Timing 38-35] Done setting XDC timing constraints.
Running Vector-less Activity Propagation...

Finished Running Vector-less Activity Propagation
51 Infos, 2 Warnings, 0 Critical Warnings and 0 Errors encountered.
report_power completed successfully
INFO: [Timing 38-91] UpdateTimingParams: Speed grade: -1, Delay Type: min_max.
INFO: [Timing 38-191] Multithreading enabled for timing update using a maximum of 2 CPUs
WARNING: [Timing 38-313] There are no user specified timing constraints. Timing constraints are needed for proper timing analysis.
INFO: [Common 17-206] Exiting Vivado at Sun Dec 15 15:11:40 2019...
